Duration,Team,Picks,Bans,Team,Picks,Bans,Winner
39:13,Natus Vincere,Warlock  Shadow Demon  Axe  Bloodseeker  Storm Spirit,Magnus  Ogre Magi  Beastmaster  Spectre  Oracle  Morphling,OG,Enchantress  Pangolier  Elder Titan  Ember Spirit  Arc Warden,Alchemist  Dark Willow  Treant Protector  Naga Siren  Batrider  Broodmother,OG
41:34,Virtus.pro,Gyrocopter  Centaur Warrunner  Silencer  Lina  Necrophos,Elder Titan  Alchemist  Omniknight  Slark  Broodmother  Dazzle,Ninjas in Pyjamas,Io  Tiny  Lich  Juggernaut  Lone Druid,Magnus  Ancient Apparition  Leshrac  Grimstroke  Dark Willow  Lifestealer,Virtus.pro
49:07,Royal Never Give Up,Elder Titan  Mirana  Omniknight  Drow Ranger  Templar Assassin,Lina  Enchantress  Rubick  Lion  Shadow Shaman  Windranger,Vici Gaming,Leshrac  Tidehunter  Warlock  Alchemist  Tusk,Shadow Demon  Ogre Magi  Outworld Devourer  Faceless Void  Sand King  Puck,Vici Gaming
36:25,Fnatic,Crystal Maiden  Magnus  Juggernaut  Dark Willow  Dragon Knight,Batrider  Omniknight  Enchantress  Arc Warden  Tidehunter  Winter Wyvern,Evil Geniuses,Ogre Magi  Ember Spirit  Rubick  Lifestealer  Vengeful Spirit,Mirana  Ancient Apparition  Leshrac  Outworld Devourer  Gyrocopter  Meepo,Fnatic
1:00:05,KEEN GAMING,Alchemist  Lina  Bane  Sand King  Queen of Pain,Mirana  Chen  Oracle  Bristleback  Timbersaw  Batrider,TNC Predator,Shadow Demon  Kunkka  Earthshaker  Slark  Rubick,Ogre Magi  Enchantress  Ancient Apparition  Tidehunter  Outworld Devourer  Leshrac,TNC Predator
41:24,Newbee,Io  Gyrocopter  Shadow Demon  Legion Commander  Outworld Devourer,Magnus  Chen  Alchemist  Storm Spirit  Weaver  Puck,Team Liquid,Elder Titan  Axe  Crystal Maiden  Anti-Mage  Pangolier,Enchantress  Mirana  Ember Spirit  Bane  Batrider  Kunkka,Newbee
21:50,Team Secret,Kunkka  Crystal Maiden  Invoker  Axe  Gyrocopter,Lina  Ancient Apparition  Ogre Magi  Oracle  Juggernaut  Storm Spirit,Alliance,Dark Willow  Tiny  Phoenix  Troll Warlord  Lone Druid,Techies  Enchantress  Alchemist  Naga Siren  Ember Spirit  Lifestealer,Team Secret
34:52,Chaos Esports Club,Grimstroke  Dazzle  Tiny  Spectre  Lycan,Enchantress  Leshrac  Warlock  Naga Siren  Ancient Apparition  Storm Spirit,PSG.LGD,Elder Titan  Sand King  Mirana  Lifestealer  Phoenix,Chen  Enigma  Shadow Demon  Alchemist  Broodmother  Beastmaster,PSG.LGD
44:42,Team Secret,Kunkka  Jakiro  Elder Titan  Broodmother  Arc Warden,Lina  Shadow Demon  Ancient Apparition  Slark  Dazzle  Sven,Alliance,Ogre Magi  Dark Willow  Oracle  Death Prophet  Tiny,Enchantress  Techies  Alchemist  Naga Siren  Ember Spirit  Faceless Void,Team Secret
47:53,Team Liquid,Beastmaster  Zeus  Alchemist  Ogre Magi  Viper,Omniknight  Enchantress  Leshrac  Chen  Timbersaw  Bloodseeker,Newbee,Mirana  Ember Spirit  Sven  Tidehunter  Ancient Apparition,Io  Broodmother  Magnus  Puck  Outworld Devourer  Huskar,Newbee
27:47,PSG.LGD,Ogre Magi  Shadow Demon  Naga Siren  Jakiro  Shadow Fiend,Enchantress  Enigma  Chen  Broodmother  Lifestealer  Visage,Chaos Esports Club,Elder Titan  Grimstroke  Sven  Underlord  Necrophos,Leshrac  Mirana  Ancient Apparition  Alchemist  Ember Spirit  Sniper,PSG.LGD
53:13,KEEN GAMING,Ancient Apparition  Ember Spirit  Rubick  Lifestealer  Timbersaw,Chen  Enigma  Oracle  Outworld Devourer  Shadow Demon  Ursa,TNC Predator,Mirana  Kunkka  Grimstroke  Bristleback  Arc Warden,Ogre Magi  Enchantress  Alchemist  Tidehunter  Batrider  Axe,TNC Predator
